exp	description	val_bpb	peak_mem_gb	tok_sec	mfu	steps	status	notes	gpu_name	baseline_sha	watts	joules_per_token	total_energy_joules
exp56	Reduce UNEMBEDDING_LR from 0.003 to 0.00285 to continue fine-tuning the output projection learning rate with conservative incremental steps, building on the successful pattern of modest LR reductions that has improved from exp13 (1.0843) through exp52 (1.0779).	1.078180	5.9	294000	16.7	2692	discard	The output projection (unembedding) layer has been systematically tuned downward	NVIDIA GeForce RTX 5090	d576495fc282c9d2d26cbee1483a2709241f551f	0.0	0.000000	0.0
exp57	Reduce SCALAR_LR from 0.28 to 0.282 to fine-tune per-layer scalar learning with ultra-conservative incremental steps, building on exp52's improvement (1.0779) and testing whether the scalar LR can be increased slightly from the previous micro-adjustments that degraded performance.	1.077712	5.9	293902	16.7	2693	keep	Recent scalar LR adjustments (exp53-exp55) all degraded performance compared to 	NVIDIA GeForce RTX 5090	d576495fc282c9d2d26cbee1483a2709241f551f	0.0	0.000000	0.0
exp58	Reduce MATRIX_LR from 0.021 to 0.0205 to continue fine-tuning the core transformer weight matrix learning rate with ultra-conservative incremental steps, building on exp52's improvement (1.0779) and the sustained success of exp57 (1.0777).	1.077887	5.9	293902	16.7	2691	discard	The learning rate tuning has been highly successful, with MATRIX_LR reductions s	NVIDIA GeForce RTX 5090	d576495fc282c9d2d26cbee1483a2709241f551f	0.0	0.000000	0.0
exp59	Increase SCALAR_LR from 0.282 to 0.284 to continue ultra-conservative fine-tuning of per-layer scalar learning, building on exp57's improvement (1.0777) and testing whether the scalar LR optimum is slightly higher.	1.078370	5.9	293568	16.7	2690	discard	exp57 achieved 1.0777 with SCALAR_LR=0.282, which was an increase from 0.28 that	NVIDIA GeForce RTX 5090	d576495fc282c9d2d26cbee1483a2709241f551f	0.0	0.000000	0.0
