exp	description	val_bpb	peak_mem_gb	tok_sec	mfu	steps	status	notes	gpu_name	baseline_sha	watts	joules_per_token	total_energy_joules
exp56	Increase MATRIX_LR from 0.037 to 0.040 to systematically explore matrix parameter learning rate tuning in finer increments around the current optimum discovered in exp44/exp55.	1.079233	5.9	294235	16.7	2695	discard	The drift alert indicates we've been over-focusing on regularization (60% of kep	NVIDIA GeForce RTX 5090	aa60cb83f527f7629edecb7dc9d7f3999cf30d5a	422.9	0.001437	126924.9
exp57	Increase SCALAR_LR from 0.5 to 0.65 to systematically explore per-layer scalar parameter learning rate under the optimal regime discovered in exp55, breaking out of regularization-dominated tuning.	1.079272	5.9	294333	16.7	2694	discard	The drift alert indicates over-reliance on regularization tuning (58% of strateg	NVIDIA GeForce RTX 5090	aa60cb83f527f7629edecb7dc9d7f3999cf30d5a	422.4	0.001436	126726.4
exp58	Increase MATRIX_LR from 0.037 to 0.035 to explore lower matrix parameter learning rates and escape the current optimization plateau.	1.079459	5.9	293902	16.7	2693	discard	The system has been tuning within a narrow regularization and schedule space (59	NVIDIA GeForce RTX 5090	aa60cb83f527f7629edecb7dc9d7f3999cf30d5a	422.9	0.001438	126919.2
exp59	Increase EMBEDDING_LR from 0.6 to 0.65 to systematically explore token embedding learning rate tuning under the optimal regime discovered in exp55, breaking out of the regularization-dominated optimization plateau.	1.079966	5.9	294000	16.7	2693	discard	The drift alert indicates we've over-focused on regularization (58% of attempts)	NVIDIA GeForce RTX 5090	aa60cb83f527f7629edecb7dc9d7f3999cf30d5a	423.4	0.001440	127035.5
